{
  "style": "ochs",
  "living_animations":
  {
    "idle": "epicfight:biped/skill/guard_sword"
  },
  "combo_attack": [
    "epicfight:biped/combat/axe_auto1",
    "epicfight:biped/combat/axe_auto2",
    "epicfight:biped/combat/sword_dual_dash",
    "epicfight:biped/combat/axe_airslash"
  ],
  "innate_skill": "epicfight:sweeping_edge",
  "revelation_attack": "epicfight:biped/combat/sword_auto1"
}